{
  "schema_version": "2.0-rc1",
  "issue_id": "2026-W39",
  "release_identity": "weekly/2026-W39",
  "status": "RELEASED",
  "release_manifest_path": "sources/2026-W39/publication/v2/release-manifest-v2.json",
  "release_manifest_sha256": "1b2a6b1e015391b3434c09af6bfc8e9bd4e3cc1be8b6cef49d13df2380a7b957",
  "merge_verification_path": "sources/2026-W39/publication/v2/merge-verification-v2.json",
  "merge_verification_sha256": "aee0a6fb186ce0977244ffed6da07e91cb25f55348b3a582f07747345c653113",
  "pdf_sha256": "eb0e49233c8f7c04077d9abc04b2811a625597abda1c7340378b1c9f8cc3e121",
  "released_at": "2026-09-29T14:24:09Z",
  "release_reference": "https://github.com/eariver/japanese-generative-ai-survey/releases/tag/weekly/2026-W39"
}
