{
  "schema_version": "2.0-rc1",
  "issue_id": "SP001",
  "release_identity": "special/SP001",
  "status": "RELEASED",
  "release_manifest_path": "sources/SP001/publication/v2/release-manifest-v2.json",
  "release_manifest_sha256": "e2f82c5d9a0fcddc9a58855f3a9fa144fd6a3aa46190acbe6fda79ab6bb5a09a",
  "merge_verification_path": "sources/SP001/publication/v2/merge-verification-v2.json",
  "merge_verification_sha256": "8d8d3fdf819d36cc28dd00491b973618189cca8ed7b327c7b2b2590d8b954786",
  "pdf_sha256": "9f6bef98d15bfaec1ea2aec3972005487c28e44ec84762e4fbaa51639d7fe1b2",
  "released_at": "2026-08-29T00:57:23Z",
  "release_reference": "https://github.com/eariver/japanese-generative-ai-survey/releases/tag/special/SP001"
}
